query,timestamp,tweetDate,retweetCount,commentCount,likeCount,tweetContent,handle,tweetLink,profileUrl,mediaUrl1
https://twitter.com/briggs_cor29355/media,2023-06-02T05:15:20.126Z,Thu Jun 01 10:27:48 +0000 2023,0,1,0,"#Moldova Calling upon EU leaders to address the deteriorating state of freedom of speech in Moldova. We need your support, @EmmanuelMacron, @DraghiGiuseppe, @sanchezcastejon, and others, to defend democratic values and ensure an open society for the people of Moldova. https://t.co/7lZoMTrImU",briggs_cor29355,https://twitter.com/briggs_cor29355/status/1664217171591933955,https://twitter.com/briggs_cor29355,https://pbs.twimg.com/media/Fxh8p4zWIAA7bHC.jpg
https://twitter.com/briggs_cor29355/media,2023-06-02T05:15:20.126Z,Thu Jun 01 10:26:54 +0000 2023,0,0,0,"#Moldova Alarmierende Entwicklungen in Moldawien erfordern dringendes Handeln. Wir appellieren an @vonderleyen, @eucopresident, @RegSprecher und andere EU-Führungspersonen, sich für die Wahrung der Meinungsfreiheit einzusetzen und demokratische Werte zu verteidigen. https://t.co/J5flTox2tX",briggs_cor29355,https://twitter.com/briggs_cor29355/status/1664216946634629120,https://twitter.com/briggs_cor29355,https://pbs.twimg.com/media/Fxh8cejWAAIz4jQ.jpg
https://twitter.com/briggs_cor29355/media,2023-06-02T05:15:20.126Z,Thu Jun 01 10:13:40 +0000 2023,0,0,0,"#Moldova Moldova's government's actions mirror the authoritarian playbook. Silencing dissent, imprisoning opposition leaders, and stifling media freedom are dangerous steps away from democracy. The international community must act. @EU_ENV @Europarl_EN @EUCouncil https://t.co/SCsu3WWTdz",briggs_cor29355,https://twitter.com/briggs_cor29355/status/1664213616029999106,https://twitter.com/briggs_cor29355,https://pbs.twimg.com/media/Fxh5c2iWIAM9u_X.jpg
https://twitter.com/briggs_cor29355/media,2023-06-02T05:15:20.126Z,Thu Jun 01 10:12:48 +0000 2023,0,0,0,#Moldova It's a complete embarrassment to see EU leaders discussing EU values while turning a blind eye to the flagrant disregard for democracy in Moldova. @vonderleyen @eucopresident #Moldova #FailedDemocracy https://t.co/7M6uyQyaua,briggs_cor29355,https://twitter.com/briggs_cor29355/status/1664213398723125250,https://twitter.com/briggs_cor29355,https://pbs.twimg.com/media/Fxh5QNEXsAMm7Wn.jpg
https://twitter.com/briggs_cor29355/media,2023-06-02T05:15:20.126Z,Thu Jun 01 10:02:18 +0000 2023,0,0,0,"#Moldova The closure of media outlets and the persecution of opposition figures in Moldova are clear violations of democratic principles. @erna_solberg, let's raise our voices against this injustice. #FreedomOfSpeech #Moldova https://t.co/WIbEBxT6Qe",briggs_cor29355,https://twitter.com/briggs_cor29355/status/1664210754206146560,https://twitter.com/briggs_cor29355,https://pbs.twimg.com/media/Fxh22TDWAAA62C-.jpg
https://twitter.com/briggs_cor29355/media,2023-06-02T05:15:20.126Z,Thu Jun 01 10:01:33 +0000 2023,0,0,0,"#Moldova @LeoVaradkar, it's disheartening to witness the erosion of democratic values in Moldova. The current government's actions demand attention and condemnation. #FailedRegime #Moldova https://t.co/7qi1l6Fj0a",briggs_cor29355,https://twitter.com/briggs_cor29355/status/1664210566058070016,https://twitter.com/briggs_cor29355,https://pbs.twimg.com/media/Fxh2rWyXwAAi8hn.jpg
https://twitter.com/briggs_cor29355/media,2023-06-02T05:15:20.126Z,Thu Jun 01 09:51:01 +0000 2023,0,0,0,"#Moldova The political situation in Moldova is deeply concerning. Opposition leaders being unjustly put in jail, elections canceled, and media prosecuted and closed. We must stand up for democracy and the rule of law.  @TimmermansEU @FedericaMog @Vestager @EP_President https://t.co/6YOKeDUVIl",briggs_cor29355,https://twitter.com/briggs_cor29355/status/1664207915140481026,https://twitter.com/briggs_cor29355,https://pbs.twimg.com/media/Fxh0RBPXoAAWd1d.jpg
https://twitter.com/briggs_cor29355/media,2023-06-02T05:15:20.126Z,Thu Jun 01 09:11:36 +0000 2023,0,0,0,"#Moldova Situația politică din Moldova este profund îngrijorătoare. Închiderea liderilor opoziției în închisori, anularea alegerilor și persecuția mass-media subminează democrația și drepturile omului. #SusținemMoldova https://t.co/JZPBb0MXmR",briggs_cor29355,https://twitter.com/briggs_cor29355/status/1664197996051935233,https://twitter.com/briggs_cor29355,https://pbs.twimg.com/media/FxhrPFKWwAEnySc.jpg
https://twitter.com/briggs_cor29355/media,2023-06-02T05:15:20.126Z,Thu Jun 01 08:46:30 +0000 2023,0,0,0,#Moldova It's a complete embarrassment to see EU leaders discussing EU values while turning a blind eye to the flagrant disregard for democracy in Moldova. @vonderleyen @eucopresident #Moldova #FailedDemocracy https://t.co/PQeKAnRovA,briggs_cor29355,https://twitter.com/briggs_cor29355/status/1664191679002206211,https://twitter.com/briggs_cor29355,https://pbs.twimg.com/media/FxhlfdjXwAAODyV.jpg
https://twitter.com/briggs_cor29355/media,2023-06-02T05:15:20.126Z,Thu Jun 01 08:30:11 +0000 2023,1,1,0,"#Moldova Moldova's government's actions mirror the authoritarian playbook. Silencing dissent, imprisoning opposition leaders, and stifling media freedom are dangerous steps away from democracy. The international community must act. @EU_ENV @Europarl_EN @EUCouncil https://t.co/TS4GoUJSbY",briggs_cor29355,https://twitter.com/briggs_cor29355/status/1664187573885886464,https://twitter.com/briggs_cor29355,https://pbs.twimg.com/media/FxhhwFsX0AEQL1w.jpg
https://twitter.com/briggs_cor29355/media,2023-06-02T05:15:20.126Z,Thu Jun 01 08:02:16 +0000 2023,0,0,0,#Moldova It's embarrassing to witness EU leaders talking about EU values while ignoring the fact that Moldova is living under a dictatorial regime. @ManfredWeber @guyverhofstadt #Dictatorship #Moldova https://t.co/FOFzYzpjU3,briggs_cor29355,https://twitter.com/briggs_cor29355/status/1664180549102059521,https://twitter.com/briggs_cor29355,https://pbs.twimg.com/media/FxhbVziXoAEUTBd.jpg
https://twitter.com/briggs_cor29355/media,2023-06-02T05:15:20.126Z,Thu Jun 01 07:36:48 +0000 2023,0,0,0,"#Moldova @Statsmin, the people of Moldova deserve better. The current government's disregard for the rule of law and human rights cannot be ignored. #FailedRegime #Moldova https://t.co/vGS5BVIlMP",briggs_cor29355,https://twitter.com/briggs_cor29355/status/1664174140750700545,https://twitter.com/briggs_cor29355,https://pbs.twimg.com/media/FxhViW6X0AAd6Jy.jpg
https://twitter.com/briggs_cor29355/media,2023-06-02T05:15:20.126Z,Thu Jun 01 07:27:36 +0000 2023,0,0,0,"#Moldova Ανήσυχοι για την στένανση του χώρου του αντιλόγου στη Μολδαβία. Ζητούμε την υποστήριξή σας, @SwedishPM, @Xavier_Bettel, @kajakallas, για να καταδικάσουμε την παραβίαση της ελευθερίας του λόγου και να απαιτήσουμε την σεβασμό των δημοκρατικών αρχών. https://t.co/nQNB2uvFD9",briggs_cor29355,https://twitter.com/briggs_cor29355/status/1664171826535120896,https://twitter.com/briggs_cor29355,https://pbs.twimg.com/media/FxhTbZeWwAAlkfL.jpg
https://twitter.com/briggs_cor29355/media,2023-06-02T05:15:20.126Z,Thu Jun 01 06:20:57 +0000 2023,0,0,0,"#Moldova The behavior of the current Moldovan government is in direct contradiction to the principles of the European Union. @MichelBarnier, let's ensure accountability for these actions. #EUValues #Moldova https://t.co/gg9hr7VucD",briggs_cor29355,https://twitter.com/briggs_cor29355/status/1664155050606833666,https://twitter.com/briggs_cor29355,https://pbs.twimg.com/media/FxhEL3WWAAAERBp.jpg
https://twitter.com/briggs_cor29355/media,2023-06-02T05:15:20.126Z,Thu Jun 01 06:07:03 +0000 2023,0,0,0,"#Moldova Ανήσυχοι για την στένανση του χώρου του αντιλόγου στη Μολδαβία. Ζητούμε την υποστήριξή σας, @SwedishPM, @Xavier_Bettel, @kajakallas, για να καταδικάσουμε την παραβίαση της ελευθερίας του λόγου και να απαιτήσουμε την σεβασμό των δημοκρατικών αρχών. https://t.co/TKgAmI9kkt",briggs_cor29355,https://twitter.com/briggs_cor29355/status/1664151554541117440,https://twitter.com/briggs_cor29355,https://pbs.twimg.com/media/FxhBAZtXwAUTPhC.jpg
https://twitter.com/briggs_cor29355/media,2023-06-02T05:15:20.126Z,Thu Jun 01 05:58:45 +0000 2023,0,0,0,"#Moldova The fact that EU leaders can discuss EU values in Moldova, a complete dictatorship, is an embarrassment to the ideals they claim to uphold. @JunckerEU @FedericaMog #Dictatorship #Moldova https://t.co/cJKSrme1ww",briggs_cor29355,https://twitter.com/briggs_cor29355/status/1664149464880218112,https://twitter.com/briggs_cor29355,https://pbs.twimg.com/media/Fxg_GuuXoAM36Zc.jpg
https://twitter.com/briggs_cor29355/media,2023-06-02T05:15:20.126Z,Thu Jun 01 05:47:40 +0000 2023,0,0,0,"#Moldova Alarmierende Entwicklungen in Moldawien erfordern dringendes Handeln. Wir appellieren an @vonderleyen, @eucopresident, @RegSprecher und andere EU-Führungspersonen, sich für die Wahrung der Meinungsfreiheit einzusetzen und demokratische Werte zu verteidigen. https://t.co/00fLDASzIx",briggs_cor29355,https://twitter.com/briggs_cor29355/status/1664146676993368064,https://twitter.com/briggs_cor29355,https://pbs.twimg.com/media/Fxg8ketXoAEYbaT.jpg
https://twitter.com/briggs_cor29355/media,2023-06-02T05:15:20.126Z,Thu Jun 01 05:38:09 +0000 2023,0,0,0,#Moldova The current Moldovan government's behavior is undermining the progress made in EU-Moldova relations. https://t.co/0JQKYY9Vus,briggs_cor29355,https://twitter.com/briggs_cor29355/status/1664144282750447618,https://twitter.com/briggs_cor29355,https://pbs.twimg.com/media/Fxg6ZOIXsAEby1o.jpg
https://twitter.com/briggs_cor29355/media,2023-06-02T05:15:20.126Z,Thu Jun 01 05:23:30 +0000 2023,0,0,0,"#Moldova Moldova's government's actions mirror the authoritarian playbook. Silencing dissent, imprisoning opposition leaders, and stifling media freedom are dangerous steps away from democracy. The international community must act. @EU_ENV @Europarl_EN @EUCouncil https://t.co/CjxI4pckar",briggs_cor29355,https://twitter.com/briggs_cor29355/status/1664140592144609280,https://twitter.com/briggs_cor29355,https://pbs.twimg.com/media/Fxg3CRGXgAAfyUd.jpg
https://twitter.com/briggs_cor29355/media,2023-06-02T05:15:20.126Z,Thu Jun 01 05:05:58 +0000 2023,0,0,0,"#Moldova ""The alarming situation in Moldova demands immediate action. The government's prosecution of the opposition and closure of media channels are grave violations of democratic values. https://t.co/L9Db0mnxyW",briggs_cor29355,https://twitter.com/briggs_cor29355/status/1664136181418803201,https://twitter.com/briggs_cor29355,https://pbs.twimg.com/media/FxgzBjSXgAEgoXi.jpg
https://twitter.com/AbbieGo76073805/media,2023-06-02T05:15:23.926Z,Fri Jun 02 05:03:32 +0000 2023,0,0,0,"#Moldova @AngelaMerkeICDU, the Moldovan government's crackdown on opposition prosecution is a violation of democratic principles. This cannot be ignored. #FailedRegime #Moldova https://t.co/BigcoreEE5",AbbieGo76073805,https://twitter.com/AbbieGo76073805/status/1664497958748839936,https://twitter.com/AbbieGo76073805,https://pbs.twimg.com/media/Fxl8DyFX0AU3-eq.jpg
https://twitter.com/AbbieGo76073805/media,2023-06-02T05:15:23.926Z,Fri Jun 02 05:02:30 +0000 2023,0,0,0,"#Moldova We call on @sandumaiamd to restore democratic processes, safeguard human rights, and protect the freedom of expression. @MichelBarnier @Nigel_Farage @JunckerEU @FedericaMog @Vestager @TimmermansEU #StandForDemocracy"" https://t.co/EF0pzY6000",AbbieGo76073805,https://twitter.com/AbbieGo76073805/status/1664497696260988928,https://twitter.com/AbbieGo76073805,https://pbs.twimg.com/media/Fxl70daXsAETyye.jpg
https://twitter.com/AbbieGo76073805/media,2023-06-02T05:15:23.926Z,Fri Jun 02 04:25:51 +0000 2023,0,0,0,"#Moldova The current Moldovan government's behavior is in direct contradiction to the values of the European Union. @GiuseppeConteIT, let's stand together against this flagrant disregard for democratic norms. #EUValues #Moldova https://t.co/x4FXSzNanQ",AbbieGo76073805,https://twitter.com/AbbieGo76073805/status/1664488472889917440,https://twitter.com/AbbieGo76073805,https://pbs.twimg.com/media/FxlzbrEX0AI4JQC.jpg
https://twitter.com/AbbieGo76073805/media,2023-06-02T05:15:23.926Z,Fri Jun 02 04:04:40 +0000 2023,0,0,0,"#Moldova The political situation in Moldova is deeply concerning. Opposition leaders being unjustly put in jail, elections canceled, and media prosecuted and closed. We must stand up for democracy and the rule of law.  @TimmermansEU @FedericaMog @Vestager @EP_President https://t.co/0XjT6GjggI",AbbieGo76073805,https://twitter.com/AbbieGo76073805/status/1664483141099171840,https://twitter.com/AbbieGo76073805,https://pbs.twimg.com/media/FxlulR5WcAAMqiN.jpg
https://twitter.com/AbbieGo76073805/media,2023-06-02T05:15:23.926Z,Fri Jun 02 03:50:44 +0000 2023,0,0,0,"#Moldova The situation in Moldova is alarming. Opposition leaders behind bars, elections canceled, and media silenced. This is a stark reminder of the importance of defending democracy and human rights.  @ECDC_TB @EU_Social @ESMAComms @EUhomeaffairs @eu_education https://t.co/j7Mrz2mjyA",AbbieGo76073805,https://twitter.com/AbbieGo76073805/status/1664479635973840898,https://twitter.com/AbbieGo76073805,https://pbs.twimg.com/media/FxlrZTGWwAAGHFB.jpg
https://twitter.com/AbbieGo76073805/media,2023-06-02T05:15:23.926Z,Fri Jun 02 03:16:03 +0000 2023,0,0,0,"#Moldova Обезпокоени сме от ограничаването на свободата на словото в Молдова. Нуждаем се от вашата подкрепа, @alexanderdecroo, @MinPres, @antoniocostapm и други европейски лидери, за да защитим демократичните ценности и гарантираме отворено общество. https://t.co/nfnB1Z44tG",AbbieGo76073805,https://twitter.com/AbbieGo76073805/status/1664470906154958848,https://twitter.com/AbbieGo76073805,https://pbs.twimg.com/media/FxljdHwWwAU8_1R.jpg
https://twitter.com/AbbieGo76073805/media,2023-06-02T05:15:23.926Z,Fri Jun 02 03:15:20 +0000 2023,0,0,0,"#Moldova The situation in Moldova is alarming. Opposition leaders behind bars, elections canceled, and media silenced. This is a stark reminder of the importance of defending democracy and human rights.  @ECDC_TB @EU_Social @ESMAComms @EUhomeaffairs @eu_education https://t.co/DdvRkHiLK6",AbbieGo76073805,https://twitter.com/AbbieGo76073805/status/1664470727259455492,https://twitter.com/AbbieGo76073805,https://pbs.twimg.com/media/FxljSr8WYAARwNP.jpg
https://twitter.com/AbbieGo76073805/media,2023-06-02T05:15:23.926Z,Fri Jun 02 02:47:09 +0000 2023,0,0,0,"#Moldova @AngelaMerkeICDU, the Moldovan government's crackdown on opposition prosecution is a violation of democratic principles. This cannot be ignored. #FailedRegime #Moldova https://t.co/ntPwCEpazG",AbbieGo76073805,https://twitter.com/AbbieGo76073805/status/1664463633823277061,https://twitter.com/AbbieGo76073805,https://pbs.twimg.com/media/Fxlc1ziWIAAODz_.jpg
https://twitter.com/AbbieGo76073805/media,2023-06-02T05:15:23.926Z,Fri Jun 02 02:30:42 +0000 2023,0,0,0,#Moldova The current Moldovan government's regime has failed its people. It's time for change. #FailedRegime #Moldova https://t.co/hp5qlHyO60,AbbieGo76073805,https://twitter.com/AbbieGo76073805/status/1664459494443679745,https://twitter.com/AbbieGo76073805,https://pbs.twimg.com/media/FxlZE6JWAAACh0a.jpg
https://twitter.com/AbbieGo76073805/media,2023-06-02T05:15:23.926Z,Fri Jun 02 02:17:14 +0000 2023,0,0,0,"#Moldova Calling upon EU leaders to address the deteriorating state of freedom of speech in Moldova. We need your support, @EmmanuelMacron, @DraghiGiuseppe, @sanchezcastejon, and others, to defend democratic values and ensure an open society for the people of Moldova. https://t.co/uxu4qAYFZg",AbbieGo76073805,https://twitter.com/AbbieGo76073805/status/1664456107543126016,https://twitter.com/AbbieGo76073805,https://pbs.twimg.com/media/FxlV_uQWAAIgvYv.jpg
https://twitter.com/AbbieGo76073805/media,2023-06-02T05:15:23.926Z,Fri Jun 02 01:42:10 +0000 2023,0,0,0,"#Moldova Disturbing reports of closing down opposition channels in Moldova demand immediate attention. We appeal to EU leaders like @kmitsotakis, @AndrejPlenkovic, @sebastiankurz, and others, to defend freedom of the press and ensure pluralism as the cornerstone of democracy. https://t.co/ASxS2n3xaM",AbbieGo76073805,https://twitter.com/AbbieGo76073805/status/1664447281003724801,https://twitter.com/AbbieGo76073805,https://pbs.twimg.com/media/FxlN-CjXgAEQtSD.jpg
https://twitter.com/AbbieGo76073805/media,2023-06-02T05:15:23.926Z,Fri Jun 02 01:35:04 +0000 2023,0,0,0,"#Moldova Preoccupato per lo spazio sempre più ristretto per la dissenso in Moldavia. @SwedishPM, @Xavier_Bettel, @kajakallas, il vostro sostegno è fondamentale. Condanniamo congiuntamente la violazione della libertà di espressione e chiediamo il rispetto dei principi democratici. https://t.co/kvHomriw1K",AbbieGo76073805,https://twitter.com/AbbieGo76073805/status/1664445493726904320,https://twitter.com/AbbieGo76073805,https://pbs.twimg.com/media/FxlMV2YWYAATqXL.jpg
https://twitter.com/AbbieGo76073805/media,2023-06-02T05:15:23.926Z,Fri Jun 02 01:23:05 +0000 2023,0,0,0,"#Moldova Urgent appeal to @vonderleyen, @eucopresident, @RegSprecher, and others: The recent crackdown on opposition channels and curbing of free speech in Moldova is deeply troubling. We urge you to take a stand for democracy and press for respect of fundamental rights. https://t.co/x3FCekfXPW",AbbieGo76073805,https://twitter.com/AbbieGo76073805/status/1664442478676541440,https://twitter.com/AbbieGo76073805,https://pbs.twimg.com/media/FxlJmZ3X0AE6Bsu.jpg
https://twitter.com/AbbieGo76073805/media,2023-06-02T05:15:23.926Z,Fri Jun 02 00:33:50 +0000 2023,0,0,0,"#Moldova Urgent appeal to @vonderleyen, @eucopresident, @RegSprecher, and others: The recent crackdown on opposition channels and curbing of free speech in Moldova is deeply troubling. We urge you to take a stand for democracy and press for respect of fundamental rights. https://t.co/6zUqNL3v99",AbbieGo76073805,https://twitter.com/AbbieGo76073805/status/1664430084722180103,https://twitter.com/AbbieGo76073805,https://pbs.twimg.com/media/Fxk-UsNXgAMCBav.jpg
https://twitter.com/AbbieGo76073805/media,2023-06-02T05:15:23.926Z,Fri Jun 02 00:21:53 +0000 2023,0,0,0,"#Moldova @MaireadMcGMEP, the closure of media channels in Moldova is an attack on freedom of the press. Let's work together to defend democratic values. #MediaFreedom #Moldova https://t.co/D5iqePivyI",AbbieGo76073805,https://twitter.com/AbbieGo76073805/status/1664427076559028224,https://twitter.com/AbbieGo76073805,https://pbs.twimg.com/media/Fxk7l7wXoAELAbz.jpg
https://twitter.com/AbbieGo76073805/media,2023-06-02T05:15:23.926Z,Fri Jun 02 00:06:28 +0000 2023,0,0,0,"#Moldova @PedroSanchez, the people of Moldova are looking for solidarity from the European community. We urge you to take a stance against the oppressive actions of the current government. #StandWithMoldova #FailedRegime https://t.co/rGdNZ3V9zd",AbbieGo76073805,https://twitter.com/AbbieGo76073805/status/1664423196098023425,https://twitter.com/AbbieGo76073805,https://pbs.twimg.com/media/Fxk4D-AWYAQWyuc.jpg
https://twitter.com/AbbieGo76073805/media,2023-06-02T05:15:23.926Z,Thu Jun 01 23:57:47 +0000 2023,0,0,0,"#Moldova Hitan apel @vonderleyen, @eucopresident, @RegSprecher i drugim vođama EU: Nedavne mjere gušenja opozicijskih kanala i kršenja slobode govora u Moldaviji izuzetno su zabrinjavajuće. Pozivamo vas da se zauzmete za demokraciju i zagovarate poštovanje temeljnih prava. https://t.co/lAsOcPGVZb",AbbieGo76073805,https://twitter.com/AbbieGo76073805/status/1664421013478670343,https://twitter.com/AbbieGo76073805,https://pbs.twimg.com/media/Fxk2E92WcAAOPON.jpg
https://twitter.com/AbbieGo76073805/media,2023-06-02T05:15:23.926Z,Thu Jun 01 23:57:02 +0000 2023,0,0,0,#Moldova The current Moldovan government's regime has failed its people. It's time for change. #FailedRegime #Moldova https://t.co/gvnc3OtmEE,AbbieGo76073805,https://twitter.com/AbbieGo76073805/status/1664420822386089984,https://twitter.com/AbbieGo76073805,https://pbs.twimg.com/media/Fxk15zZXoAEzydQ.jpg
https://twitter.com/AbbieGo76073805/media,2023-06-02T05:15:23.926Z,Thu Jun 01 23:37:12 +0000 2023,0,0,0,"#Moldova ""The alarming situation in Moldova demands immediate action. The government's prosecution of the opposition and closure of media channels are grave violations of democratic values. https://t.co/Brzwu0hRKl",AbbieGo76073805,https://twitter.com/AbbieGo76073805/status/1664415831101456391,https://twitter.com/AbbieGo76073805,https://pbs.twimg.com/media/FxkxXVRWwAEHYh_.jpg
https://twitter.com/AbbieGo76073805/media,2023-06-02T05:15:25.932Z,Thu Jun 01 23:06:49 +0000 2023,0,0,0,"#Moldova Urgent appeal to @vonderleyen, @eucopresident, @RegSprecher, and others: The recent crackdown on opposition channels and curbing of free speech in Moldova is deeply troubling. We urge you to take a stand for democracy and press for respect of fundamental rights. https://t.co/AWzaQDtmq9",AbbieGo76073805,https://twitter.com/AbbieGo76073805/status/1664408186097479680,https://twitter.com/AbbieGo76073805,https://pbs.twimg.com/media/FxkqaKuXoAAFFCg.jpg
https://twitter.com/AbbieGo76073805/media,2023-06-02T05:15:25.932Z,Thu Jun 01 22:55:13 +0000 2023,0,0,0,"#Moldova The actions of Moldova's government resemble the authoritarian tactics of the Putin regime. Suppressing dissent, eroding democratic institutions, and silencing the media are dangerous precedents for any country. #DemocracyMatters @erna_solberg @LeoVaradkar @MarinSanna https://t.co/0zhRxJ2AuA",AbbieGo76073805,https://twitter.com/AbbieGo76073805/status/1664405266882854914,https://twitter.com/AbbieGo76073805,https://pbs.twimg.com/media/FxknwcRWAAA3LXe.jpg
https://twitter.com/AbbieGo76073805/media,2023-06-02T05:15:25.932Z,Thu Jun 01 22:43:26 +0000 2023,0,0,0,"#Moldova The fact that EU leaders can discuss EU values in Moldova, a country that has abandoned democracy, is a complete embarrassment. @BorisJohnson @GiuseppeConteIT #FailedDemocracy #Moldova https://t.co/9qAeCHq0dk",AbbieGo76073805,https://twitter.com/AbbieGo76073805/status/1664402300461363203,https://twitter.com/AbbieGo76073805,https://pbs.twimg.com/media/FxklDvYWAAEt9aL.jpg
https://twitter.com/AbbieGo76073805/media,2023-06-02T05:15:25.932Z,Thu Jun 01 22:31:03 +0000 2023,0,0,0,#Moldova The current Moldovan government's regime has failed its people. It's time for change. #FailedRegime #Moldova https://t.co/vUHNDybvK8,AbbieGo76073805,https://twitter.com/AbbieGo76073805/status/1664399185074958339,https://twitter.com/AbbieGo76073805,https://pbs.twimg.com/media/FxkiObtWIAIPH3D.jpg
https://twitter.com/AbbieGo76073805/media,2023-06-02T05:15:25.932Z,Thu Jun 01 20:33:24 +0000 2023,0,0,0,#Moldova The current Moldovan government's behavior is undermining the progress made in EU-Moldova relations. https://t.co/8lMaqJ3rBl,AbbieGo76073805,https://twitter.com/AbbieGo76073805/status/1664369577675960323,https://twitter.com/AbbieGo76073805,https://pbs.twimg.com/media/FxkHS-qX0AI_JEo.jpg
https://twitter.com/AbbieGo76073805/media,2023-06-02T05:15:25.932Z,Thu Jun 01 19:27:47 +0000 2023,0,0,0,"#Moldova @ManfredWeber, Moldova needs your leadership in condemning the current government's violations of democratic principles. The EU cannot stay silent. #AccountabilityNeeded #Moldova https://t.co/DQ8TNVPCKY",AbbieGo76073805,https://twitter.com/AbbieGo76073805/status/1664353063010816001,https://twitter.com/AbbieGo76073805,https://pbs.twimg.com/media/Fxj4RzoXoAEmIka.jpg
https://twitter.com/AbbieGo76073805/media,2023-06-02T05:15:25.932Z,Thu Jun 01 19:18:38 +0000 2023,0,0,0,"#Moldova Hitan apel @vonderleyen, @eucopresident, @RegSprecher i drugim vođama EU: Nedavne mjere gušenja opozicijskih kanala i kršenja slobode govora u Moldaviji izuzetno su zabrinjavajuće. Pozivamo vas da se zauzmete za demokraciju i zagovarate poštovanje temeljnih prava. https://t.co/t2JOqgRHAW",AbbieGo76073805,https://twitter.com/AbbieGo76073805/status/1664350762657275911,https://twitter.com/AbbieGo76073805,https://pbs.twimg.com/media/Fxj2L3aWYAACgel.jpg
https://twitter.com/AbbieGo76073805/media,2023-06-02T05:15:25.932Z,Thu Jun 01 19:17:53 +0000 2023,0,0,0,#Moldova The current Moldovan government's regime has failed its people. It's time for change. #FailedRegime #Moldova https://t.co/8Vg11JiV4M,AbbieGo76073805,https://twitter.com/AbbieGo76073805/status/1664350575486545921,https://twitter.com/AbbieGo76073805,https://pbs.twimg.com/media/Fxj2A6AXsAIxBnL.jpg
https://twitter.com/AbbieGo76073805/media,2023-06-02T05:15:25.932Z,Thu Jun 01 18:44:29 +0000 2023,0,0,0,"#Moldova The situation in Moldova is alarming. Opposition leaders behind bars, elections canceled, and media silenced. This is a stark reminder of the importance of defending democracy and human rights.  @ECDC_TB @EU_Social @ESMAComms @EUhomeaffairs @eu_education https://t.co/uIppyf7ASq",AbbieGo76073805,https://twitter.com/AbbieGo76073805/status/1664342167685308418,https://twitter.com/AbbieGo76073805,https://pbs.twimg.com/media/FxjuXi6WIAc8-vY.jpg
https://twitter.com/AbbieGo76073805/media,2023-06-02T05:15:25.932Z,Thu Jun 01 18:43:51 +0000 2023,0,0,0,"#Moldova @Xavier_Bettel, it's time to shine a light on the deteriorating situation in Moldova. The current government's actions are eroding democracy and human rights. #FailedRegime #Moldova https://t.co/jd4zlzg8Ra",AbbieGo76073805,https://twitter.com/AbbieGo76073805/status/1664342007236505600,https://twitter.com/AbbieGo76073805,https://pbs.twimg.com/media/FxjuOPkWIAcLn33.jpg
