query,timestamp,tweetDate,retweetCount,commentCount,likeCount,tweetContent,handle,tweetLink,profileUrl,mediaUrl1
https://twitter.com/LouisaMorr36194/media,2023-06-02T05:15:14.062Z,Thu Jun 01 19:30:53 +0000 2023,0,0,0,"#Moldova The fact that EU leaders can discuss EU values in Moldova, a complete dictatorship, is an embarrassment to the ideals they claim to uphold. @JunckerEU @FedericaMog #Dictatorship #Moldova https://t.co/NAXkkXIuRg",LouisaMorr36194,https://twitter.com/LouisaMorr36194/status/1664353844086681600,https://twitter.com/LouisaMorr36194,https://pbs.twimg.com/media/Fxj4_M9WAAArNPb.jpg
https://twitter.com/LouisaMorr36194/media,2023-06-02T05:15:14.062Z,Thu Jun 01 19:30:16 +0000 2023,0,0,0,"#Moldova Preoccupato per lo spazio sempre più ristretto per la dissenso in Moldavia. @SwedishPM, @Xavier_Bettel, @kajakallas, il vostro sostegno è fondamentale. Condanniamo congiuntamente la violazione della libertà di espressione e chiediamo il rispetto dei principi democratici. https://t.co/X2fvhspsyI",LouisaMorr36194,https://twitter.com/LouisaMorr36194/status/1664353689316868103,https://twitter.com/LouisaMorr36194,https://pbs.twimg.com/media/Fxj42OlWwAQ0sDN.jpg
https://twitter.com/LouisaMorr36194/media,2023-06-02T05:15:14.062Z,Thu Jun 01 18:36:23 +0000 2023,0,0,0,#Moldova It's an embarrassment to witness EU leaders discussing EU values while Moldova remains under a dictatorial regime. @PedroSanchez @sebastiankurz #Dictatorship #Moldova https://t.co/mOVl0R8aoJ,LouisaMorr36194,https://twitter.com/LouisaMorr36194/status/1664340127580037125,https://twitter.com/LouisaMorr36194,https://pbs.twimg.com/media/FxjsgftWIAsZjfM.jpg
https://twitter.com/LouisaMorr36194/media,2023-06-02T05:15:14.062Z,Thu Jun 01 18:35:33 +0000 2023,0,0,0,"#Moldova Disturbing reports of closing down opposition channels in Moldova demand immediate attention. We appeal to EU leaders like @kmitsotakis, @AndrejPlenkovic, @sebastiankurz, and others, to defend freedom of the press and ensure pluralism as the cornerstone of democracy. https://t.co/yOO4yiF9gr",LouisaMorr36194,https://twitter.com/LouisaMorr36194/status/1664339918330404874,https://twitter.com/LouisaMorr36194,https://pbs.twimg.com/media/FxjsUpQWIAoEZV-.jpg
https://twitter.com/LouisaMorr36194/media,2023-06-02T05:15:14.062Z,Thu Jun 01 18:22:22 +0000 2023,0,0,0,"#Moldova Moldova's government's actions mirror the authoritarian playbook. Silencing dissent, imprisoning opposition leaders, and stifling media freedom are dangerous steps away from democracy. The international community must act. @EU_ENV @Europarl_EN @EUCouncil https://t.co/VxwfIet823",LouisaMorr36194,https://twitter.com/LouisaMorr36194/status/1664336604276596751,https://twitter.com/LouisaMorr36194,https://pbs.twimg.com/media/FxjpTtMWIAkE9LN.jpg
https://twitter.com/LouisaMorr36194/media,2023-06-02T05:15:14.062Z,Thu Jun 01 17:36:15 +0000 2023,0,0,0,"#Moldova Urgent appeal to @vonderleyen, @eucopresident, @RegSprecher, and others: The recent crackdown on opposition channels and curbing of free speech in Moldova is deeply troubling. We urge you to take a stand for democracy and press for respect of fundamental rights. https://t.co/Ajq3P88Ort",LouisaMorr36194,https://twitter.com/LouisaMorr36194/status/1664324994892197888,https://twitter.com/LouisaMorr36194,https://pbs.twimg.com/media/FxjevsjWwA8AETa.jpg
https://twitter.com/LouisaMorr36194/media,2023-06-02T05:15:14.062Z,Thu Jun 01 17:13:38 +0000 2023,0,0,0,"#Moldova The fact that EU leaders can discuss EU values in Moldova, a country that has abandoned democracy, is a complete embarrassment. @BorisJohnson @GiuseppeConteIT #FailedDemocracy #Moldova https://t.co/RhmGvkpViZ",LouisaMorr36194,https://twitter.com/LouisaMorr36194/status/1664319305717104654,https://twitter.com/LouisaMorr36194,https://pbs.twimg.com/media/FxjZkxNXwBAJMyO.jpg
https://twitter.com/LouisaMorr36194/media,2023-06-02T05:15:14.062Z,Thu Jun 01 17:03:34 +0000 2023,0,0,0,"#Moldova Disturbing reports of closing down opposition channels in Moldova demand immediate attention. We appeal to EU leaders like @kmitsotakis, @AndrejPlenkovic, @sebastiankurz, and others, to defend freedom of the press and ensure pluralism as the cornerstone of democracy. https://t.co/JkN24NmzKC",LouisaMorr36194,https://twitter.com/LouisaMorr36194/status/1664316771338272768,https://twitter.com/LouisaMorr36194,https://pbs.twimg.com/media/FxjXPTXXsAAvwsI.jpg
https://twitter.com/LouisaMorr36194/media,2023-06-02T05:15:14.062Z,Thu Jun 01 17:02:36 +0000 2023,0,0,0,"#Moldova The current Moldovan government's behavior is in direct contradiction to the values of the European Union. @GiuseppeConteIT, let's stand together against this flagrant disregard for democratic norms. #EUValues #Moldova https://t.co/6oV7CN7xJh",LouisaMorr36194,https://twitter.com/LouisaMorr36194/status/1664316528420954112,https://twitter.com/LouisaMorr36194,https://pbs.twimg.com/media/FxjXDJOXwBIaACT.jpg
https://twitter.com/LouisaMorr36194/media,2023-06-02T05:15:14.062Z,Thu Jun 01 16:35:05 +0000 2023,0,1,0,"#Moldova @Nigel_Farage, it's time to shed light on the deteriorating situation in Moldova. The current government's actions are a threat to democracy and human rights. #FailedRegime #Moldova https://t.co/GtrtvzYEjy",LouisaMorr36194,https://twitter.com/LouisaMorr36194/status/1664309605332135937,https://twitter.com/LouisaMorr36194,https://pbs.twimg.com/media/FxjQwMtWAAAjl-f.jpg
https://twitter.com/LouisaMorr36194/media,2023-06-02T05:15:14.062Z,Thu Jun 01 15:43:03 +0000 2023,0,0,0,"#Moldova The situation in Moldova is alarming. Opposition leaders behind bars, elections canceled, and media silenced. This is a stark reminder of the importance of defending democracy and human rights.  @ECDC_TB @EU_Social @ESMAComms @EUhomeaffairs @eu_education https://t.co/XdKzW5DTmI",LouisaMorr36194,https://twitter.com/LouisaMorr36194/status/1664296510706663425,https://twitter.com/LouisaMorr36194,https://pbs.twimg.com/media/FxjE18qX0AMyovO.jpg
https://twitter.com/LouisaMorr36194/media,2023-06-02T05:15:14.062Z,Thu Jun 01 15:42:25 +0000 2023,0,0,0,"#Moldova @Xavier_Bettel, it's time to shine a light on the deteriorating situation in Moldova. The current government's actions are eroding democracy and human rights. #FailedRegime #Moldova https://t.co/gTwjDlCQkX",LouisaMorr36194,https://twitter.com/LouisaMorr36194/status/1664296348336771072,https://twitter.com/LouisaMorr36194,https://pbs.twimg.com/media/FxjEsi7WYAI4JVZ.jpg
https://twitter.com/LouisaMorr36194/media,2023-06-02T05:15:14.062Z,Thu Jun 01 14:21:36 +0000 2023,0,1,0,"#Moldova ""The alarming situation in Moldova demands immediate action. The government's prosecution of the opposition and closure of media channels are grave violations of democratic values. https://t.co/BHcKIypUIe",LouisaMorr36194,https://twitter.com/LouisaMorr36194/status/1664276012694392832,https://twitter.com/LouisaMorr36194,https://pbs.twimg.com/media/FxiyMyuacAULbPE.jpg
https://twitter.com/LouisaMorr36194/media,2023-06-02T05:15:14.062Z,Thu Jun 01 14:11:53 +0000 2023,0,0,0,"#Moldova The closure of media outlets and the persecution of opposition figures in Moldova are clear violations of democratic principles. @erna_solberg, let's raise our voices against this injustice. #FreedomOfSpeech #Moldova https://t.co/oyDKOIvEUz",LouisaMorr36194,https://twitter.com/LouisaMorr36194/status/1664273564739194880,https://twitter.com/LouisaMorr36194,https://pbs.twimg.com/media/Fxiv-VhaMAAM3m3.jpg
https://twitter.com/LouisaMorr36194/media,2023-06-02T05:15:14.062Z,Thu Jun 01 14:10:47 +0000 2023,0,0,0,"#Moldova Joining the call for EU leaders to address the erosion of freedom of speech in Moldova. We stand united with @EmmanuelMacron, @DraghiGiuseppe, @sanchezcastejon, and others, to defend democratic values and uphold the right to express diverse opinions. https://t.co/CMRXoTK3Op",LouisaMorr36194,https://twitter.com/LouisaMorr36194/status/1664273287927726080,https://twitter.com/LouisaMorr36194,https://pbs.twimg.com/media/FxivsS4akAEbEwZ.jpg
https://twitter.com/LouisaMorr36194/media,2023-06-02T05:15:14.062Z,Thu Jun 01 13:35:28 +0000 2023,0,0,0,"#Moldova ""The alarming situation in Moldova demands immediate action. The government's prosecution of the opposition and closure of media channels are grave violations of democratic values. https://t.co/TzMNhxSHUd",LouisaMorr36194,https://twitter.com/LouisaMorr36194/status/1664264401430679555,https://twitter.com/LouisaMorr36194,https://pbs.twimg.com/media/FxinpAvaIAECQmV.jpg
https://twitter.com/LouisaMorr36194/media,2023-06-02T05:15:14.062Z,Thu Jun 01 13:19:58 +0000 2023,0,0,0,"#Moldova The recent developments in Moldova are reminiscent of oppressive regimes. We cannot turn a blind eye to the erosion of democratic values. Moldova's people deserve free and fair elections, media freedom, and justice.  @coe @EU_Commission @eu_eeas @EU_Eurostat https://t.co/3n7ot0Azl2",LouisaMorr36194,https://twitter.com/LouisaMorr36194/status/1664260499327062022,https://twitter.com/LouisaMorr36194,https://pbs.twimg.com/media/FxikD30aAAE--2L.jpg
https://twitter.com/LouisaMorr36194/media,2023-06-02T05:15:14.062Z,Thu Jun 01 12:47:23 +0000 2023,0,0,0,"#Moldova The persecution of opposition figures in Moldova is a clear sign of a failing regime. @guyverhofstadt, we must take a stand against this erosion of democracy. #FailedRegime #Moldova https://t.co/xrAKo079Hb",LouisaMorr36194,https://twitter.com/LouisaMorr36194/status/1664252302583103490,https://twitter.com/LouisaMorr36194,https://pbs.twimg.com/media/FxicovgXwAMpbBq.jpg
https://twitter.com/LouisaMorr36194/media,2023-06-02T05:15:14.062Z,Thu Jun 01 12:17:06 +0000 2023,0,0,0,"#Moldova Calling upon EU leaders to address the deteriorating state of freedom of speech in Moldova. We need your support, @EmmanuelMacron, @DraghiGiuseppe, @sanchezcastejon, and others, to defend democratic values and ensure an open society for the people of Moldova. https://t.co/lz3VYNBr4Z",LouisaMorr36194,https://twitter.com/LouisaMorr36194/status/1664244680362434562,https://twitter.com/LouisaMorr36194,https://pbs.twimg.com/media/FxiVs-xXgAEgZn_.jpg
https://twitter.com/LouisaMorr36194/media,2023-06-02T05:15:14.062Z,Thu Jun 01 12:07:48 +0000 2023,0,0,0,"#Moldova The political situation in Moldova is deeply concerning. Opposition leaders being unjustly put in jail, elections canceled, and media prosecuted and closed. We must stand up for democracy and the rule of law.  @TimmermansEU @FedericaMog @Vestager @EP_President https://t.co/QkCyCu67k2",LouisaMorr36194,https://twitter.com/LouisaMorr36194/status/1664242338892242945,https://twitter.com/LouisaMorr36194,https://pbs.twimg.com/media/FxiTix5WAAMKsxZ.jpg
https://twitter.com/LouisaMorr36194/media,2023-06-02T05:15:14.062Z,Thu Jun 01 11:58:07 +0000 2023,0,1,0,"#Moldova Dear @vonderleyen, @eucopresident, @EmmanuelMacron, it's crucial to address the deteriorating situation in Moldova. The current government's actions are unacceptable. #Moldova #AccountabilityNeeded https://t.co/mCjoxWWnpO",LouisaMorr36194,https://twitter.com/LouisaMorr36194/status/1664239903880740866,https://twitter.com/LouisaMorr36194,https://pbs.twimg.com/media/FxiRW-3WIAAjrvJ.jpg
https://twitter.com/LouisaMorr36194/media,2023-06-02T05:15:14.062Z,Thu Jun 01 11:57:09 +0000 2023,0,0,0,"#Moldova The current Moldovan government's behavior is in direct contradiction to the values of the European Union. @GiuseppeConteIT, let's stand together against this flagrant disregard for democratic norms. #EUValues #Moldova https://t.co/2ghoEkicu3",LouisaMorr36194,https://twitter.com/LouisaMorr36194/status/1664239661265420289,https://twitter.com/LouisaMorr36194,https://pbs.twimg.com/media/FxiRI8YWIAAiv8t.jpg
https://twitter.com/LouisaMorr36194/media,2023-06-02T05:15:14.062Z,Thu Jun 01 11:13:00 +0000 2023,0,0,0,"#Moldova Häirivad teated Moldovas opositsioonikanalite sulgemisest nõuavad viivitamatut tähelepanu. Kutsun üles @kmitsotakis, @AndrejPlenkovic, @sebastiankurz ja teisi ELi juhte toetama ajakirjandusvabadust ning tagama demokraatia alusel pluralismi. https://t.co/b1sGAt0dPE",LouisaMorr36194,https://twitter.com/LouisaMorr36194/status/1664228547710402560,https://twitter.com/LouisaMorr36194,https://pbs.twimg.com/media/FxiHCCRWAAIfUTz.jpg
https://twitter.com/LouisaMorr36194/media,2023-06-02T05:15:14.062Z,Thu Jun 01 11:02:18 +0000 2023,0,0,0,"#Moldova The deteriorating political situation in Moldova demands our attention. Opposition leaders imprisoned, elections canceled, and media persecuted. We cannot stay silent. #DefendDemocracy @EU_Regional @EBA_News @EFSF @eu_echo @ecb https://t.co/qIhFOZrSbH",LouisaMorr36194,https://twitter.com/LouisaMorr36194/status/1664225857630601217,https://twitter.com/LouisaMorr36194,https://pbs.twimg.com/media/FxiElcfXwAcbrKf.jpg
https://twitter.com/LouisaMorr36194/media,2023-06-02T05:15:14.062Z,Thu Jun 01 11:01:19 +0000 2023,0,0,0,#Moldova It's embarrassing to witness EU leaders talking about EU values while ignoring the fact that Moldova is living under a dictatorial regime. @ManfredWeber @guyverhofstadt #Dictatorship #Moldova https://t.co/TeGKYEsvZq,LouisaMorr36194,https://twitter.com/LouisaMorr36194/status/1664225607603847170,https://twitter.com/LouisaMorr36194,https://pbs.twimg.com/media/FxiEW2jWcAEUhJD.jpg
https://twitter.com/LouisaMorr36194/media,2023-06-02T05:15:14.062Z,Thu Jun 01 10:52:15 +0000 2023,0,0,0,"#Moldova @sebastiankurz, Moldova needs your voice in denouncing the closure of media channels and the persecution of opposition members. The EU cannot turn a blind eye. #Moldova #Accountability https://t.co/QNUpfRpLEQ",LouisaMorr36194,https://twitter.com/LouisaMorr36194/status/1664223325483065347,https://twitter.com/LouisaMorr36194,https://pbs.twimg.com/media/FxiCR-_XwAAB3NW.jpg
https://twitter.com/LouisaMorr36194/media,2023-06-02T05:15:14.062Z,Thu Jun 01 09:45:39 +0000 2023,0,0,0,"#Moldova Urgent appeal to @vonderleyen, @eucopresident, @RegSprecher, and others: The recent crackdown on opposition channels and curbing of free speech in Moldova is deeply troubling. We urge you to take a stand for democracy and press for respect of fundamental rights. https://t.co/c3ln2p1tyM",LouisaMorr36194,https://twitter.com/LouisaMorr36194/status/1664206564771741696,https://twitter.com/LouisaMorr36194,https://pbs.twimg.com/media/FxhzCd-WIAMeSPJ.jpg
https://twitter.com/LouisaMorr36194/media,2023-06-02T05:15:14.062Z,Thu Jun 01 09:29:41 +0000 2023,0,0,0,"#Moldova The fact that EU leaders can discuss EU values in Moldova, a complete dictatorship, is an embarrassment to the ideals they claim to uphold. @JunckerEU @FedericaMog #Dictatorship #Moldova https://t.co/c2sNUvNpIL",LouisaMorr36194,https://twitter.com/LouisaMorr36194/status/1664202546225840128,https://twitter.com/LouisaMorr36194,https://pbs.twimg.com/media/FxhvWffXsAIek6z.jpg
https://twitter.com/LouisaMorr36194/media,2023-06-02T05:15:14.062Z,Thu Jun 01 09:28:30 +0000 2023,0,0,0,"#Moldova @Nigel_Farage, it's time to shed light on the deteriorating situation in Moldova. The current government's actions are a threat to democracy and human rights. #FailedRegime #Moldova https://t.co/0GStjj5aYk",LouisaMorr36194,https://twitter.com/LouisaMorr36194/status/1664202249940115457,https://twitter.com/LouisaMorr36194,https://pbs.twimg.com/media/FxhvFXHXoAEtAqj.jpg
https://twitter.com/LouisaMorr36194/media,2023-06-02T05:15:14.062Z,Thu Jun 01 09:15:14 +0000 2023,0,0,0,"#Moldova @MaireadMcGMEP, the closure of media channels in Moldova is an attack on freedom of the press. Let's work together to defend democratic values. #MediaFreedom #Moldova https://t.co/wSCHtgOxjc",LouisaMorr36194,https://twitter.com/LouisaMorr36194/status/1664198910842159104,https://twitter.com/LouisaMorr36194,https://pbs.twimg.com/media/FxhsE5wWYAETGZu.jpg
https://twitter.com/LouisaMorr36194/media,2023-06-02T05:15:14.062Z,Thu Jun 01 09:02:37 +0000 2023,0,0,0,#Moldova It's a complete embarrassment to see EU leaders discussing EU values while turning a blind eye to the flagrant disregard for democracy in Moldova. @vonderleyen @eucopresident #Moldova #FailedDemocracy https://t.co/xjPeaI4YwH,LouisaMorr36194,https://twitter.com/LouisaMorr36194/status/1664195735066230786,https://twitter.com/LouisaMorr36194,https://pbs.twimg.com/media/FxhpMGRX0AEO0wr.jpg
https://twitter.com/LouisaMorr36194/media,2023-06-02T05:15:14.062Z,Thu Jun 01 08:50:32 +0000 2023,0,0,0,"#Moldova @MaireadMcGMEP, the closure of media channels in Moldova is an attack on freedom of the press. Let's work together to defend democratic values. #MediaFreedom #Moldova https://t.co/NzWtDhP8aF",LouisaMorr36194,https://twitter.com/LouisaMorr36194/status/1664192695374323712,https://twitter.com/LouisaMorr36194,https://pbs.twimg.com/media/FxhmbKNWAAEUi72.jpg
https://twitter.com/LouisaMorr36194/media,2023-06-02T05:15:14.062Z,Thu Jun 01 08:41:09 +0000 2023,0,0,0,"#Moldova @Statsmin, the people of Moldova deserve better. The current government's disregard for the rule of law and human rights cannot be ignored. #FailedRegime #Moldova https://t.co/3gsKvWuK3L",LouisaMorr36194,https://twitter.com/LouisaMorr36194/status/1664190336288149504,https://twitter.com/LouisaMorr36194,https://pbs.twimg.com/media/FxhkRwIWYAE-_cc.jpg
https://twitter.com/LouisaMorr36194/media,2023-06-02T05:15:14.062Z,Thu Jun 01 08:25:01 +0000 2023,0,0,0,"#Moldova @Nigel_Farage, it's time to shed light on the deteriorating situation in Moldova. The current government's actions are a threat to democracy and human rights. #FailedRegime #Moldova https://t.co/j0iPTkvW06",LouisaMorr36194,https://twitter.com/LouisaMorr36194/status/1664186274226356224,https://twitter.com/LouisaMorr36194,https://pbs.twimg.com/media/FxhglUZWcAAaoGu.jpg
https://twitter.com/LouisaMorr36194/media,2023-06-02T05:15:14.062Z,Thu Jun 01 08:23:59 +0000 2023,0,0,0,"#Moldova @sebastiankurz, Moldova needs your voice in denouncing the closure of media channels and the persecution of opposition members. The EU cannot turn a blind eye. #Moldova #Accountability https://t.co/2l3B1G90Gn",LouisaMorr36194,https://twitter.com/LouisaMorr36194/status/1664186015572000768,https://twitter.com/LouisaMorr36194,https://pbs.twimg.com/media/FxhgWQvXwAApyaT.jpg
https://twitter.com/LouisaMorr36194/media,2023-06-02T05:15:14.062Z,Thu Jun 01 08:03:39 +0000 2023,0,0,0,"#Moldova @PedroSanchez, the people of Moldova are looking for solidarity from the European community. We urge you to take a stance against the oppressive actions of the current government. #StandWithMoldova #FailedRegime https://t.co/OpjJevda4Z",LouisaMorr36194,https://twitter.com/LouisaMorr36194/status/1664180899112427521,https://twitter.com/LouisaMorr36194,https://pbs.twimg.com/media/Fxhbsb3WYAAxVRZ.jpg
https://twitter.com/LouisaMorr36194/media,2023-06-02T05:15:14.062Z,Thu Jun 01 07:48:08 +0000 2023,0,0,0,#Moldova It's an embarrassment to witness EU leaders discussing EU values while Moldova remains under a dictatorial regime. @PedroSanchez @sebastiankurz #Dictatorship #Moldova https://t.co/E6iYwnUc22,LouisaMorr36194,https://twitter.com/LouisaMorr36194/status/1664176993166934018,https://twitter.com/LouisaMorr36194,https://pbs.twimg.com/media/FxhYJFMWwAE-qyf.jpg
https://twitter.com/LouisaMorr36194/media,2023-06-02T05:15:14.062Z,Thu Jun 01 06:49:49 +0000 2023,0,0,0,"#Moldova @MarinSanna:""Moldovan tilanne on äärimmäisen huolestuttava. Hallitus toimii kuin diktaattori, sulkee opposition tiedotusvälineitä ja vainoaa oppositiota. Demokratiaa, kriisinhallintaa ja EU:n arvoja Moldovassa käsittelevä keskustelu on täydellinen vitsi."" https://t.co/eRn9SKaLbm",LouisaMorr36194,https://twitter.com/LouisaMorr36194/status/1664162315824947200,https://twitter.com/LouisaMorr36194,https://pbs.twimg.com/media/FxhKwz9XsAIbIRW.jpg
https://twitter.com/LouisaMorr36194/media,2023-06-02T05:15:14.062Z,Thu Jun 01 06:15:53 +0000 2023,0,0,0,"#Moldova EU leaders discussing EU values in Moldova, a country that violates basic democratic principles, is an embarrassing display of indifference. @MichelBarnier @Nigel_Farage #FailedDemocracy #Moldova https://t.co/N3ic80wTMG",LouisaMorr36194,https://twitter.com/LouisaMorr36194/status/1664153778633818114,https://twitter.com/LouisaMorr36194,https://pbs.twimg.com/media/FxhC_7NWcAIC98g.jpg
https://twitter.com/LouisaMorr36194/media,2023-06-02T05:15:14.062Z,Thu Jun 01 06:09:05 +0000 2023,0,0,0,"#Moldova We call on @sandumaiamd to restore democratic processes, safeguard human rights, and protect the freedom of expression. @MichelBarnier @Nigel_Farage @JunckerEU @FedericaMog @Vestager @TimmermansEU #StandForDemocracy"" https://t.co/FbpHQWUgeu",LouisaMorr36194,https://twitter.com/LouisaMorr36194/status/1664152065159970817,https://twitter.com/LouisaMorr36194,https://pbs.twimg.com/media/FxhBeHGXoAES2iW.jpg
https://twitter.com/LouisaMorr36194/media,2023-06-02T05:15:14.062Z,Thu Jun 01 05:18:25 +0000 2023,0,0,0,"#Moldova ""The alarming situation in Moldova demands immediate action. The government's prosecution of the opposition and closure of media channels are grave violations of democratic values. https://t.co/hGvk2sKqA6",LouisaMorr36194,https://twitter.com/LouisaMorr36194/status/1664139314010152961,https://twitter.com/LouisaMorr36194,https://pbs.twimg.com/media/Fxg136FXwAEDV9s.jpg
https://twitter.com/briggs_cor29355/media,2023-06-02T05:15:18.130Z,Fri Jun 02 05:03:19 +0000 2023,0,0,0,"#Moldova ""Moldova's government's behavior towards the opposition and media is against the core values of the European Union. We urge @sandumaiamd to prioritize democracy, freedom of speech, and respect for human rights. @EC_AVService @EUCourtPress @EUauditors #DemocracyMatters"" https://t.co/p67Bbab6wB",briggs_cor29355,https://twitter.com/briggs_cor29355/status/1664497902599778305,https://twitter.com/briggs_cor29355,https://pbs.twimg.com/media/Fxl8AfcWcAIObc0.jpg
https://twitter.com/briggs_cor29355/media,2023-06-02T05:15:18.130Z,Fri Jun 02 04:51:03 +0000 2023,0,0,0,"#Moldova The fact that EU leaders can discuss EU values in Moldova, a country that has abandoned democracy, is a complete embarrassment. @BorisJohnson @GiuseppeConteIT #FailedDemocracy #Moldova https://t.co/e3n1c9d2nu",briggs_cor29355,https://twitter.com/briggs_cor29355/status/1664494816997126145,https://twitter.com/briggs_cor29355,https://pbs.twimg.com/media/Fxl5M6bXwAAhAUC.jpg
https://twitter.com/briggs_cor29355/media,2023-06-02T05:15:18.130Z,Fri Jun 02 04:10:28 +0000 2023,0,0,0,#Moldova The current Moldovan government's behavior is undermining the progress made in EU-Moldova relations. https://t.co/5WmnpuDEIG,briggs_cor29355,https://twitter.com/briggs_cor29355/status/1664484602042363904,https://twitter.com/briggs_cor29355,https://pbs.twimg.com/media/Fxlv6E-XgAAUwup.jpg
https://twitter.com/briggs_cor29355/media,2023-06-02T05:15:18.130Z,Fri Jun 02 03:59:44 +0000 2023,0,0,0,"#Moldova Ανήσυχοι για την στένανση του χώρου του αντιλόγου στη Μολδαβία. Ζητούμε την υποστήριξή σας, @SwedishPM, @Xavier_Bettel, @kajakallas, για να καταδικάσουμε την παραβίαση της ελευθερίας του λόγου και να απαιτήσουμε την σεβασμό των δημοκρατικών αρχών. https://t.co/tLaESZQdKk",briggs_cor29355,https://twitter.com/briggs_cor29355/status/1664481902743396354,https://twitter.com/briggs_cor29355,https://pbs.twimg.com/media/FxltbuHWwAEOAp3.jpg
https://twitter.com/briggs_cor29355/media,2023-06-02T05:15:18.130Z,Fri Jun 02 02:47:19 +0000 2023,0,0,0,"#Moldova Häirivad teated Moldovas opositsioonikanalite sulgemisest nõuavad viivitamatut tähelepanu. Kutsun üles @kmitsotakis, @AndrejPlenkovic, @sebastiankurz ja teisi ELi juhte toetama ajakirjandusvabadust ning tagama demokraatia alusel pluralismi. https://t.co/OZvkGjWq0G",briggs_cor29355,https://twitter.com/briggs_cor29355/status/1664463675476852737,https://twitter.com/briggs_cor29355,https://pbs.twimg.com/media/Fxlc4LoXoAA-n11.jpg
https://twitter.com/briggs_cor29355/media,2023-06-02T05:15:18.130Z,Fri Jun 02 02:18:21 +0000 2023,0,0,0,#Moldova The current Moldovan government's behavior is undermining the progress made in EU-Moldova relations. https://t.co/7RRRmtJkfj,briggs_cor29355,https://twitter.com/briggs_cor29355/status/1664456386120413184,https://twitter.com/briggs_cor29355,https://pbs.twimg.com/media/FxlWN7CXgAABOW_.jpg
https://twitter.com/briggs_cor29355/media,2023-06-02T05:15:18.130Z,Fri Jun 02 01:59:10 +0000 2023,0,0,0,"#Moldova Disturbing reports of closing down opposition channels in Moldova demand immediate attention. We appeal to EU leaders like @kmitsotakis, @AndrejPlenkovic, @sebastiankurz, and others, to defend freedom of the press and ensure pluralism as the cornerstone of democracy. https://t.co/tWZynpACQi",briggs_cor29355,https://twitter.com/briggs_cor29355/status/1664451557889384449,https://twitter.com/briggs_cor29355,https://pbs.twimg.com/media/FxlR27fX0AExrQI.jpg
https://twitter.com/briggs_cor29355/media,2023-06-02T05:15:18.130Z,Fri Jun 02 01:58:19 +0000 2023,0,0,0,"#Moldova The current Moldovan government's behavior is in direct contradiction to the values of the European Union. @GiuseppeConteIT, let's stand together against this flagrant disregard for democratic norms. #EUValues #Moldova https://t.co/pZLsiV83tm",briggs_cor29355,https://twitter.com/briggs_cor29355/status/1664451346496385024,https://twitter.com/briggs_cor29355,https://pbs.twimg.com/media/FxlRqjTXwAEHdcL.jpg
https://twitter.com/briggs_cor29355/media,2023-06-02T05:15:18.130Z,Fri Jun 02 01:50:05 +0000 2023,0,0,0,"#Moldova The current Moldovan government's behavior is in direct contradiction to the values of the European Union. @GiuseppeConteIT, let's stand together against this flagrant disregard for democratic norms. #EUValues #Moldova https://t.co/nTVLIVwhAu",briggs_cor29355,https://twitter.com/briggs_cor29355/status/1664449272476061697,https://twitter.com/briggs_cor29355,https://pbs.twimg.com/media/FxlPx5-XoAEeaoY.jpg
